id,word_count,is_long,article,reference
5039ebd23350eb09c21b054abf6c97e5fca8c4af,887,True,"In February of this year, bride-to-be Adele McKenzie found the dress she had dreamed of wearing when she married her partner of nine years, David Elliot. Little did she know she would never get the chance to wear it, despite already paying for half. The 31-year-old said when she slipped into the white lacy gown, she instantly saw herself standing in front of her friends and family and exchanging marriage vows with the love of her life. ‘I had dreamt about this princess dress since I was a little girl,’ she told Daily Mail Australia. Adele McKenzie was set to marry the love of her life, David Elliot, when she was devastated to learn the bridal company she had paid around $1,000 to for her dress had closed down . Ms McKenzie said she wasn't able to buy the $2,000 dress outright so she organised a payment plan with ‘The Bridal Centre’. She started paying in February and planned to pay off her dress by July - around three months before her wedding - giving her time to make alterations. In early April, Ms McKenzie’s dress dream was shattered when she opened an email from the bridal company that said they were going bankrupt. Ms McKenzie told Daily Mail Australia she was left feeling ‘panicked’ and ‘anxious’ when she was faced with the news that she would need to find a new wedding dress for her big day. ‘My first reaction was to call The Bridal Centre and it was consistently busy across the long weekend. Their Facebook was active and we were putting up posts without a response.' The Bridal Centre's Facebook page was inundated with messages from disappointed brides who already had their hearts set on a wedding dress . Ms McKenzie was one of around 140 brides who received the same ‘generic’ email informing them their dream dresses may not be coming, some of them with their weddings only weeks away. She tried to go onto the Bridal Centre's website but it was deactivated and that's when she realised she had no way of getting in contact with the company she already paid $1,000, which was meant to go towards paying off her dress. The happy couple have been together for nine years and plan to wed in November 2015 . ‘It was stressful and pretty upsetting,’ she said. Ms McKenzie was one of around 140 brides who received the same ‘generic’ email informing them their dream dresses may not be coming, some of them with weddings only weeks away. Amid the devastation, the brides-to-be banded together to create a Facebook page that would allow them to 'connect' and 'support each other' through the confusing time. Ms McKenzie said the group called ‘Where’s My Dress?’ became inundated with ‘generous offers’ from ‘lovely ladies’ and ‘amazing bridal companies’ who offered them free ‘pre-loved’, and even brand new, wedding gowns. While some women have received their money back, unfortunately Ms McKenzie said she is still waiting to hear from the Bridal Centre about whether she will be one of the lucky ones who can use that money to buy another dress. Ms McKenzie revealed she would need another $1,000 deposit to move forward with a different dress, however at this stage, with all the financial pressure that comes with planning a wedding, she isn't sure she can afford it. ‘It’s very difficult financially, I can’t take the next step to get another dress. I don’t know if I’m going to get it back.’ ‘I am six months out of my wedding and I’m anxious and stressed out,' she said. Amid the devastation, the brides-to-be banded together to create a Facebook page that would allow them to 'connect' and 'support each other' through the confusing time. Ms McKenzie is expecting around 70 guests at her wedding that will be held in Sydney's Terrey Hills, with some travelling from interstate and overseas. 'There’s a lot of planning and  it’s added pressure on top.' 'It’s getting more difficult as the weeks draw closer,’ she added. Ms McKenzie said the trusting brides had no idea the company was facing financial difficulties as they continued to take payments from their clients right up until the day before they sent the email that notified them of their money woes. ‘[It] is just disgraceful. They knew what was happening. If they didn't want to tell us the truth, that’s fine, but don’t take our money,’ she said. ‘At the end of the day, I’m marrying the man of my dreams so I’m trying to not let it affect it too much.’ After thinking she had secured the dress she had dreamed of since she was a little girl, Ms McKenzie said she was devastated she was going to have to fight to get it back. ‘You find this dress and you fall in love with it. Now I have to go through this process, it’s so upsetting. ‘I don’t want this,’ she added. Ms McKenzie said despite her awful experience she is trying to move forward and instead focus on  on the man who will be standing at the end of the aisle, regardless of what she is wearing. ‘At the end of the day, I’m marrying the man of my dreams so I’m trying to not let it affect it too much.’","The Bridal Centre, in Brisbane, shut down unexpectedly earlier this month .
Around 140 brides were left out of pocket and without a dress .
They created a Facebook page called 'Where's My Dress' so the women could connect and try to find alternative ways to get their dream dress .
Ladies and bridal companies started to donate dresses to the women .
Adele McKenzie was one of the women who have been left without a dress .
She said the way the brides have been treated is 'disgraceful'
Many brides have taken to social media to slam the bankrupt company ."
d1817ab81ef20f2cbaa84918e259bc0fbdc1c917,919,True,"A nine-year-old girl who plummeted 30ft headfirst down the inside of a hollow tree claims she 'went to heaven and sat in Jesus's lap' while unconscious after the fall. Her mother, Christy Wilson Beam, 42, has spoken of her amazement after  Annabel, now 12, escaped the horrifying accident unscathed - even waking miraculously cured of a devastating illness that had plagued her childhood. For the first time in her life, she can eat solid food – and her mother thinks her brush with Jesus is the reason why. Scroll down for video . Annabel Beam, now 12, believes she visited Heaven when unconscious after falling 30ft at the age of nine . Annabel (centre), with her mother Christy and father Kevin and her sisters Abigail (right) and Adelynn (left) In December, 2011, Annabel was playing outside the family's Texas home with her sisters Abigail, now 14 and Adelynn, now ten, when she slipped and fell inside a hollowed-out cottonwood tree. Mum Christy said: 'She hit her head three times on the way down and this is consistent with the findings of an MRI scan. 'With the facts in front of me now, I see it all with sickening clarity. 'Sometimes at night, it replays in my head – a dark twist on Alice tumbling down the rabbit hole.' An emergency fire crew managed to harness Annabel to safety and she was rushed to Cook Children's Hospital in Fort Worth in a helicopter. Fearing the worst, medics prepped brain and spinal injury teams to stand by for Annabel's arrival – but, incredibly, she survived without a scratch. Video: Today . Annabel survived the horrific fall with only bumps and bruises. The doctors said 'I guess someone up there was looking out for her' Annabel's mother, Christy, and father, Kevin, believe their daughter, saying she 'has no interest in melodrama' Doctors told her relieved parents: 'I guess someone up there was looking out for her.' 'The ER doc told us the one thing we weren't expecting to hear,' her mother said. 'He said, ""Other than a possibly concussion and some superficial bumps and bruises, she doesn't appear to have been injured at all."" '[My husband] Kevin and I exchanged a look of pure astonishment.' In the days following the accident, Annabel began to talk of religious visions she experienced while lying unconscious. She told her parents: 'I went to heaven when I was in that tree. I sat in Jesus' lap.' 'I saw in Anna's eyes the conscious decision to confide in us,' Christy said. 'There was no drama, she wasn't playing either. 'This wasn't like one of her long, spun-out recaps of a funny dream or movie she'd seen. 'She'd been through enough real drama in her short life. She had no interest in melodrama. '[She described] some of what she'd experienced while inside the tree – how the gates of Heaven are made of gold, how Jesus told her it wasn't time.' A cross marks the hollowed-out cottonwood tree, where Annabel plummeted 30ft headfirst to the bottom . Initially, Christy was concerned that Annabel was indicating a head injury, but MRI and CT scans revealed she had not sustained one. Further tests also revealed Annabel had remarkably stopped displaying symptoms of pseudo-obstruction motility disorder, a rare incurable condition that had seen her in and out of hospital since 2008. Doctors advised she could begin to come off the antibiotics she had been taking for years. Instead of taking ten different types of medication throughout the day, she only needed three, and the painkillers that were prescribed 'as and when she needed them' were not required at all. Previously, Annabel's medication meant she had to have a liquid diet or stick to soft, bland food – but now, she can happily tuck into pizzas and McDonald's happy meals. The family have gone more than a year without a single visit to the doctor. 'I can't explain what happened to her physically while she was in that tree,' said her father Kevin. 'All I have to go on is the radiological data and the medical records from before and after. 'The proof is in the pudding. She wasn't well before and now she is. 'All I know beyond that is that she believes she went to Heaven. And I believe her when she tells me she believes it.' Nine-year-old Annabel was playing outside with her sisters Abigail and Adelynn when she fell inside the tree . Annabel said she saw a fairy-like guardian angel as she gained consciousness, and it stayed with her while she was rescued, shining a light so she could see . Annabel talked of seeing a 'guardian angel' as she came to. The schoolgirl said: 'I started to wake up in the tree and I could hear the firemen's voices. And I saw an angel that looked very small, like a fairy. 'And the God winked at me through the body of the angel and what He was saying to me was, 'I'm going to leave you now and everything is going to be okay. 'And then the angel stayed with me the entire time, shining a light so I could see. We didn't talk. We just sat together peacefully.' She also spoke of seeing Mimi, her great-grandmother who'd died in 2010 after surgery on a blocked intestine. When asked what Jesus looked like, Annabel said: 'He had a beautiful long white robe, dark skin and a big beard – kinda like Santa Claus, but not really.'","Nine-year-old 'saw Heaven and sat in Jesus's lap' while unconscious .
Annabel, from Texas, survived headfirst fall with only bumps and bruises .
The schoolgirl woke up cured from illness that had plagued her childhood .
Claims fairy-like guardian angel sat with her while she was rescued ."
4231a5fa6241f4550c370a9e18d1b9a0429f9c0e,672,True,"Denial: Al Sharpton today slammed a report claiming he was banner from the funeral of Walter Scott . Al Sharpton has denied that the family of police shooting victim Walter Scott have barred him from attending his funeral because it would cause a 'circus' of media attention. The controversial preacher and civil rights campaigner said a report that the family wanted him gone to avoid 'another Ferguson type of circus' is 'bogus'. He also announced that he would head to North Charleston, South Carolina, to preach and attend a vigil on Sunday, the day after the funeral. Allegations that Scott's family wanted nothing to do with Sharpton were published by the New York Daily News. In response, Sharpton said: 'There has never been a discussion about me attending or participating in the funeral on Saturday, since everyone knows that [National Action Network’s] convention with thousands of delegates is happening in New York and doesn't end until Saturday night.' Anthony Scott, the victim's brother, said today that the National Action Network has been working with the family since Walter Scott was shot on Saturday April 4. Incendiary cell phone footage showed Scott being gunned down from behind by Slager after he was pulled over for having a broken tail light. Slager was fired, arrested and charged with murder when the video came to light, reigniting tensions around policing which took center stage in Ferguson, Missouri, after teenager Michael Brown was killed. Family: The New York Daily News claimed that Sharpton's family asked him to stay away to avoid a 'circus'. He has said it is untrue . Incendiary: Scott was shot dead by Officer Michael Slager, right, in North Charleston, South Carolina. After video footage, above, emerged of the killing, Slager was charged with murder . Sharpton said the incident proves that a new law is necessary to compel all police officers in the country to wear body cameras while on patrol. He confirmed his intention Friday morning to preach at North Charleston's Charity Missionary Baptist Church. He said his message will be that justice should be pursued 'in a peaceful, legal way'. After giving a service, he said he will attend a vigil at the spot where Scott was killed. Sharpton's involvement comes after dashcam footage from Slager's patrol car was released, showing the traffic stop moments before the shooting. From before: This footage shows Scott running away from Slager after being pulled over in his car . Slager is seen confronting Scott over his busted tail light and asking for documentation, which Scott says he does not have. When Slager returns to his patrol car, Scott flees and the officer gives chase. It is not clear what happened in the time between the dashcam footage and the cell phone video. After the shooting it emerged that Scott was some $7,500 behind in child support payments. It had been reported that a warrant was out for his arrest for this reason - but that was later shown to be false. Vigil: Sympathizers laid flowers at a makeshift memorial in North Charleston at the spot where Scott was killed . Tributes: A man is pictured above adjusting flower displays and condolence messages in the grassy lot where Scott was killed . Records show that he last paid child support in July 2012. But there was no bench warrant directing officers to bring him in to face a family court judge. Scott had been in jail three times over child support. In 2008, after a traffic stop in which he was charged with an open-container violation and driving under suspension, he was sent to jail in Charleston for six months for failing to pay about $6,800. In 2011, bench warrants ordered deputies to bring him in, and Scott spent a night in jail when he was $7,500 behind. In 2012, he spent another night in jail when he owed $3,500. Family members have said he may have run from Saturday's traffic stop because he feared going back to jail over more back child support.","Preacher and civil rights leader said reports of a funeral ban are 'bogus'
Will head to North Charleston, South Carolina, to preach on Sunday .
Walter Scott, 50, was shot dead by Michael Slager almost a week ago ."
cc2dfc15e772a08841f3435823adf24fc1aa8f0a,538,True,"Three people were arrested for being drunk and disorderly on a Ryanair plane that was about to leave Britain for the Algarve. Two 49-year-old women and a 23-year-old man  were removed from the plane just before it left Bristol for Faro around 7pm yesterday (Thursday). Chris Ware, head of security at Bristol Airport said: 'The Bristol Airport police team were requested by flight crew to attend a delayed departing flight to Faro. A Ryanair flight took off without three booked passengers bound for Faro yesterday after they were arrested for being drunk and disorderly . 'The airline requested the delayed passengers board the flight in anticipation of the air traffic slot time improving. 'Three passengers were removed from the aircraft and subsequently arrested. 'Abusive, aggressive or anti-social behaviour on board an aircraft or at the Airport will not be tolerated, the normal protocol of dealing with disruptive passengers was implemented. 'Unfortunately the actions of these individual passengers further delayed the aircraft's departure.' Airport Team Sergeant Mick Parminter added: 'We want everyone who travels through the airport to have a safe and enjoyable start to their trip. 'We would warn anyone travelling through the airport to know their limits. Passengers have a personal responsibility for their own behaviour. 'On average over half a million passengers travel through the airport every month without incident however we will not allow the behaviour of a few to spoil the enjoyment and travel plans for everyone else. 'Alcohol-related anti-social behaviour will not be tolerated.' Bristol Airport confirmed that the drunk passengers' actions caused further delays to the Ryanair flight . A spokesperson for Ryanair told MailOnline Travel: 'The crew of this flight from Bristol to Faro requested police assistance prior to departure after three customers became disruptive. Police removed and detained these individuals before the aircraft departed to Faro. 'We will not tolerate unruly or disruptive behaviour at any time and we sincerely apologised to other customers for any inconvenience caused. 'The safety and comfort of our customers, crew and aircraft is our number one priority. This is now a matter for local police.' This latest incident comes only days after Ryanair took the unprecedented step of banning passengers from bringing their own booze on board flights between Glasgow and the party island of Ibiza out of concerns for safety and comfort. The Dublin-based airline informed passengers travelling on the notorious flight from Glasgow Prestwick Airport to the Spanish island that their alcohol purchases from duty free shops are no longer allowed in the cabin, and they risk being kicked off the flight if they don't comply. In a statement to MailOnline Travel, a Ryanair spokesman said the airline made the decision after consultations with customers and airport officials. The spokesman said: 'Those who have purchased duty free alcohol will be asked to either place their purchases in their cabin baggage and into the hold at the boarding gate, or leave their purchases behind. 'The comfort and safety of our customers and crew is our number one priority and we will not tolerate unruly behaviour at any time.' The spokesman declined to identify the incidents which sparked the ban or say what will happen to passengers caught trying to sneak alcohol on board.","Two women aged 49 and a 23-year-old man removed from plane .
Incident caused further delays for Ryanair flight to Faro from Bristol .
Airport security re-affirm anti-social behaviour will be dealt with harshly ."
be38db35ac29a25db9cbb18c2a6db5c315f0944b,413,True,"Stuart McCall has dismissed any thought of his Rangers future being decided before the end of the season as he stressed his Ibrox revival had yet to achieve anything. McCall has restored a buoyancy to the club and won approval from supporters after three successive wins — including triumphs over Hibs and Hearts — ahead of tonight’s trip to face Queen of the South. The former Motherwell boss arrived last month on a deal until the end of the season, with a brief to try to rekindle their promotion push. Stuart McCall has dismissed any thought of his Rangers future being decided before the end of the season . McCall has restored a buoyancy to the club and won approval from supporters after three successive wins . And he is adamant he doesn’t expect any meaningful talks with the Ibrox board until after the play-offs. ‘There’s been no conversation,’ said McCall. ‘At the moment there’s a feelgood factor about the club. ‘The only thing that has happened, apart from results improving, is that self-belief, confidence and morale have come back into the dressing room — along with the support — so we all seem to be onside. McCall is adamant that despite the revival, his Rangers side are yet to achieve anything in the Championship . ‘But that’s all it is. Nothing, I’d imagine, will happen with me until the end of the season. I’m totally, 100 per cent fine with that and all our focus is on winning. ‘We’ve done nothing. We’ve won three games. Football can change so quickly. We have got a really difficult game at Queen of the South, so we’re not taking anything for granted. ‘Contract-wise for me, I know my gig. I’m here until the end of the season and beyond that, I honestly don’t know.’ Shane Ferguson is finally set to arrive at Murray Park next week as part of the loan deal from Newcastle . Meanwhile, Shane Ferguson is finally set to arrive at Murray Park next week, two months after being part of the controversial five-man loan deal struck with Newcastle United. McCall is a fan of the Northern Ireland international but is cautious about his chances of featuring after a long-term knee injury. ‘I think he has done almost two weeks of training,’ said McCall. ‘Unless he is one of these lads who is really fit and can come straight back into it, he will need at least three or four Under-20s games.’","Stuart McCall has led Rangers to three successive wins in recent weeks .
Triumphs against Hibs and Hearts won supporters' approval .
But he says he does not expect new contract talks until after play-offs .
McCall stresses that Rangers are yet to achieve anything despite revival ."
