id,word_count,is_long,article,reference
e269d56d6fb15738b179cb40eedc24c38b82ea51,826,True,"A young woman who ate just 10 calories a day while in the grip of anorexia has spoken of how she fought her way back from the brink of death. Beth Hall, 24, from Cambridge, plummeted to a tiny 4st 13lb after battling the horrific eating disorder since her teenage years - while working in a chocolate shop. Tormented by bullies at school, she began a strict diet regime at the age of 16, living off nothing more than black tea and coffee. Determined to lose weight, she would often go for up to three days without eating a single thing. But after years of turmoil, she was finally admitted to an eating disorder clinic. And after making a full recovery, she is now a healthy size 8 and studying graphics at university. Scroll down for video . Beth Hall, now 24, from Cambridge, plummeted to a tiny 4st 13lbs (left) after being bullied at school. She has now gained weight to be a size 8 (right) At the height of her anorexia, Miss Hall would live on just 10 calories a day - or go three days without eating a single thing . Miss Hall said: 'I'm so relieved that I have managed to maintain a healthy weight after battling anorexia. 'It didn't matter how many pounds I dropped, I would always see a fat pig when I looked in the mirror. 'I would ditch my lunch at school and when my mum was diagnosed with skin cancer in 2008 I was able to disguise my eating habits as she was having treatment in hospital.' She admits she would go up to three days without eating a single thing - but remained adamant there was nothing wrong with her. 'I lived on black coffee and tea which is around 10 calories per day, I was starving my body so badly that I couldn't even think straight,' she recalled. Miss Hall was forced to drop out of university in 2009 after her eating disorder took control of her life and she struggled to cope with the work load. She added: 'I couldn't focus on anything but food, my illness was completely out of control and I was getting thinner and thinner by the day. 'I eventually got a job as a sales assistant, ironically in a chocolate shop but I was so weak and I didn't know how much more my body would take.' Then in 2011, she developed a kidney infection, leading doctors to warn she was risking her life by starving her body. Beth said: 'The doctor told me he could feel all my organs underneath my skin and that I would end up killing myself if my eating didn't improve. 'I suddenly realised that I needed help and at just 4st 13lbs, I was admitted to an eating disorder ward once my kidney infection cleared up. She said: 'I lived on black coffee and tea which is around 10 calories per day, I was starving my body so badly that I couldn't even think straight'. Miss Hall is pictured now at a healthy weight . It was only when a doctor warned he could feel all of her organs underneath her skin - and that she would end up killing herself if she didn't eat - that she sought help . 'I hated having to gain weight and eating the meals they had given me but I knew I needed to be there.' This, combined with daily group therapy sessions, saw her begin to make progress - and after four months at the eating disorder clinic, she was allowed home. 'I was finally in control of my own meals again and could attend the therapy sessions as an outpatient,' said Miss Hall. Despite suffering a relapse one year later she is now back at university and working part-time. She said: 'I'm now studying graphic design at Anglia Ruskin University in Cambridge. 'I did suffer a relapse, but the therapy sessions gave me the coping skills I needed to get my eating habits back under control.' She added: 'My whole family, including my younger sister, Georgina, were so worried about me when my weight dropped so drastically. 'It has been a massive relief for everyone that I have been able to get my weight under control and that I'm a healthy size 8. 'I know my illness will always be there but I know how to deal with it all now. 'I hope other girls who read my story are able to gain hope from everything I have achieved. 'There is always help available and, despite how isolated you feel, things will get better and you can overcome an eating disorder.' Miss Hall said: 'I hope other girls who read my story are able to gain hope from everything I have achieved. There is always help available and, despite how isolated you feel, things will get better and you can overcome an eating disorder'","Beth Hall, 24, from Cambridge, plummeted to a tiny 4st 13lb at her worst .
Had begun the strict starvation regime at 16 after being bullied at school .
Says she survived off tea and coffee and would go days without eating .
Only when she was warned she was killing herself did she seek help ."
bd20515fe147191add4d9d478a5b2d74a74791b9,397,True,"These days art appears to be everywhere we look, which means that it’s not always easy to be original in our creative endeavours. However one artistic soul proved there are still simple ways to make the mundane interesting when he used four plastic cups and a marker pen to create something truly unique. Filming a demonstration of his creation, the video maker and artist holds up two see-through plastic cups that he has stacked into one another. The video maker holds two stacked cups up to the camera and rotates through the various hairstyles . Drawn on the inside cup is a head and a torso and pictured on the outside cup are a selection of haircuts. Rotating the outer cup, the man brings the numerous haircuts, which include a Mohawk, short hair with a beard, a quiff and brushed hair with a moustache, into alignment with the head. Settling on the afro, the man then stacks a third cup, which has a number of outfits drawn onto it, including a jacket, a t-shirt and a bikini. The video maker selects an afro hairstyle and then stacks a third cup, which has outfits drawn on it . The artist initially uploaded the video to Reddit and claims to be have been influenced by Japanese comics . He settles on a shirt and then adds the fourth and final cup that has a selection of accessories drawn onto it. Moving through the choices, the video maker finally decides on a pair of glasses and holds his randomised creation up to the camera. The video was initially uploaded to Reddit by the user named toper-centage. The video maker rotates the third cup and scrolls through the outfits before settling on a shirt . The filmmaker adds the final cup and after rotating through the various accessories picks a pair of glasses . Answering various questions on the site, the filmmaker stated that he based his style on Japanese comics. He wrote: ‘I read a lot of Manga and did some self-learning a few years ago.’ Adding: ‘I'm a software engineer and this is a way to cope with mental blocks and frustration.’ According to another user there are a total 294 possible combinations that can be made from rotating the cups. According to one Reddit user there are a total of 294 possible combinations that can be made .","Filmmaker rotates four stacked see-through plastic cups .
He selects an afro hair type, a shirt and a pair of glasses .
The video maker initially uploaded his creation to Reddit .
One user stated there are a total of 294 possible variations ."
065cb87a025be1dd2d212a7190ba0100f80394fc,605,True,"Patients are being put at risk because paramedics are leaving firemen to deal with 999 calls, healthcare leaders warn. Many firemen have not been trained in basic first aid – yet they are being left to care for seriously ill elderly patients for hours while they wait for an ambulance. The Fire Brigades Union say the practice is irresponsible and dangerous but is becoming increasingly common because the ambulance service is so overstretched. The ambulance service is becoming increasingly reliant on firemen to attend life-threatening emergencies . The Fire Brigade Union say the practice is irresponsible and dangerous and becoming more common . Senior union officials say fire engines are routinely being turned into makeshift ambulances to ferry patients to A&E. They normally carry a few blankets, oxygen masks to protect against smokes and a defibrillator – to restart the heart. In one case earlier this year an elderly lady is feared to have died because she was left in the hands of fire crews for nearly 40 minutes while paramedics were delayed. The ambulance service is facing unprecedented demand from the rising and aging population and in some areas 999 calls are up by 15 per cent on last year. Paramedics are also having to respond to rising numbers of non-urgent calls from patients frustrated that they cannot get an appointment with their GP. They are also having to waste much of their time queued up outside A&E units which cannot accept their patients because staff there are also very busy. This has all led to the ambulance service increasingly relying on firemen to attend potentially life-threatening emergencies. The Fire Brigades Union yesterday warned that South Yorkshire Fire and Rescue were sending firemen with no medical training to 999 calls instead of ambulances. It pointed out that only a third of firefighters at this branch had any medical training – and even this only consisted of a four day course of basic first aid. Yet in one case they were left to help an elderly lady who had stopped breathing for 45 minutes whilst they waited for the ambulance to arrive. Senior union officials say fire engines are routinely being turned into makeshift ambulances to ferry patients to A&E . In another, they tended to a pensioner who had fallen and banged her head for two hours before they were forced to leave her on her own – to attend a fire. The practice is occurring across the country and last July, firemen took a 16-year-old girl with suspected bleeding on the brain to A&E in Warrington, Cheshire . In December, crews were sent to a care home in Ryde on the Isle of Wight where an elderly woman had a stroke and were ordered to cut the rings off her fingers which were turning blue because of poor blood flow. Ian Murray, vice-president of the Fire Brigades Union – which represents 44,000 firemen – said: 'We know only a small percentage of firefighters are trained to give basic first aid. 'It is irresponsible and dangerous to put untrained firefighters in the position of attending incidents to assist the ambulance service, with the knowledge that it is highly unlikely one will arrive for some considerable time.' In January, a woman of 84 from Doncaster is feared to have died because firemen were sent to her home rather than an ambulance. Paramedics did not show up for 40 minutes after which time her pulse had stopped. Last month the Mail revealed how London Ambulance Service had resorted to flying half way round the world to Australia to hire 225 paramedics because it is so overstretched.","The Fire Brigades Union say practice is irresponsible and dangerous .
But becoming more common as ambulance service is so overstretched .
Ambulance service facing huge demand from rising and aging population .
Led to them relying more on firemen to attend life threatening emergencies ."
47ee16163b9b0ae62115bcc3828b087a7c33fc0e,560,True,"Kate Major Lohan has been arrested for a 'drunken attack' on her husband Michael Lohan, TMZ report. Kate - who was ordered to rehab by Michael last year - is said to have had an alcohol relapse before getting physical with the father of Lindsay Lohan. TMZ report that Michael made a 911 call around 7:02pm on Thursday claiming his wife had struck him after coming home inebriated. Scroll down for video... Busted: Kate Major arrested AGAIN after she 'drunkenly attacked' Michael Lohan after a heated argument on Thursday at their home in . Their argument then turned physical, with Kate began scratching Michael's back. The site also reports that when police arrived Kate was visibly intoxicated, had slurred speech and blood shot eyes. Kate reportedly admitted she had been drinking, claimed Michael grabbed her by the throat and that the argument was caused by him accusing her of cheating. Fiery: Michael (pictured here with Kate in 2010) was not wearing a shirt during the argument, and his wife reportedly began scratching his back . She was then taken to the Palm Beach Country Jail and charged for battery. A recording of his 911 call, obtained by TMZ, captures Michael pleading for police to come and arrest his wife. ‘Please ma'am I need help. My wife, she is drunk and on pills and she just attacked me,' Michael says as the sound of a baby crying in background can be heard. When asked if he was okay, he replied: 'I'm more cut up. She just got out of jail. DWI the works. We are locked outside. I think the baby got hurt… she was hitting me and the baby. I got it all on tape.’ The 911 dispatcher then enquires into what kind of drugs Kate has been using: ‘Yeah she has been smoking marijuana, and taking pills and she went to get food and came back drunk. She is actually on a detox from alcohol [right now].’ Adding: ‘She's on Valium and […]. Yes, prescribed by a doctor, but the marijuana is not.’ The dispatcher then asks if Kate is in need of medical assistance. Family drama: Speaking to TMZ, Michael (pictured with daughter Lindsay and ex wife Dina Lohan in 2003) blamed his ongoing custody battle with Dina for his fiery relationship with his new wife . ‘No, no, I was running away,’ Michael replies. ‘I have video [of it all].’ The recording ends with Michael saying, ‘She is telling our son to say I hit her. Can you believe it? She is crazy. Listen to that drunk.’ Speaking to TMZ, Michael blamed his ongoing custody battle with ex-wife Dina Lohan for his fiery relationship with his new wife. He tells them: 'At the end of the day, this is all because of what Dina is doing in court... It affects Kate too, and like anyone with a drug or alcohol problem, when they can't handle the stress, they resort to drinking.' Last year, Dina filed court documents claiming that Michael refuses to pay for his son Cody's $10,000-a-year school fees. It's not the first time Michael's troubled wife Kate has run into problems with the law. Kate was arrested in March 2013 after Michael called the police following another drunken feud. She was pulled over by police where she tested three times over the drink drive limit.","Kate Major Lohan has been arrested for a 'drunken attack' on her husband Michael Lohan .
Kate - who was ordered to rehab by Michael last year - is said to have had an alcohol relapse before getting physical with the father of Lindsay Lohan .
New 911 call recording reveals Michael believed his wife was under the influence of marijuana, two prescriptions drugs, and alcohol .
A child can be heard crying in the background of the 911 call recording ."
0ecc8cb598f4bdee432dd9d5de63bd64d74eb794,176,False,"Featherstone prop James Lockwood has been given a two-year ban for breaching the Rugby Football League's anti-doping regulations in the first finding of its kind in the UK. The 29-year-old former Dewsbury forward was handed the suspension by UK Anti-Doping (UKAD) after a sample taken in an out-of-competition test last November returned a positive test for growth hormone releasing factors. In a statement, UKAD said: 'The Drug Control Centre at King's College, London, identified the presence of Growth Hormone Releasing Peptide-2 (pralmorelin) and its metabolite in Mr Lockwood's A sample. James Lockwood has been banned for two years after failing a doping test . 'These are classified under section S2 of the WADA 2014 Prohibited List. This is the first finding of its kind in the UK. 'The athlete is banned from all competition from 3 March 2015 to 2 March 2017.' Lockwood has spent the last three seasons with Featherstone after joining them from Dewsbury in 2012 and was in their team that lost 36-12 to Leigh in last October's Championship Grand Final at Headingley.","Rugby league star James Lockwood has been banned for two years .
Featherstone prop tested positive for growth hormone releasing factors .
Former Dewsbury player was part of team that lost 2014 Grand Final ."
af332c8234c8ca3fb289b0566b65f17dd4a06236,831,True,"Together they wrote a string of chart-topping hits for some of the world's biggest stars and created the memorable theme tune of Australian television soap Neighbours. Tony Hatch and Jackie Trent, who were married for more than three decades, were dubbed 'Mr and Mrs Music' after composing for artists including Frank Sinatra, Dean Martin, Scott Walker, Shirley Bassey and Petula Clark. So when Trent died last month aged 74 after a long battle with cancer, Hatch was expected to be at her funeral to say a final goodbye. True, their marriage had ended in divorce, but they had a daughter together and one of the most successful creative unions in showbusiness. But The Mail on Sunday can reveal that Hatch was banned from the funeral by Trent's second husband, Colin Gregory, who today accuses the composer of breaking his wife's heart. Scroll down for video . Tony Hatch (left) and his former wife Jackie Trent (right) wrote a chart-topping hits for the world's biggest stars but he was banned from her funeral last month . He says that not only did she never forgive Hatch for the infidelity that ended their marriage, but she believed to her dying day that he had denied her the credit she was due for some of their compositions. Although they were responsible for about 400 songs together, they had been mired in a long-running feud over seven that Trent claimed she co-wrote. After years of pressure, says Gregory, Hatch agreed to acknowledge Trent's part and her name now appears against some of the songs on the Tony Hatch website. But on other songs, Hatch is the only composer credited. Gregory told The Mail on Sunday: 'Yes, I banned Hatch from attending Jackie's cremation.' The 71-year-old former policeman, who married Trent in 2005, said: 'It might seem petty and churlish of me because, whatever anybody says, Hatch and Trent are welded at the hip for all the wonderful work they did together. 'I would never contest that. Jackie never contested that. But her firm words to me were, ""I hate him for what he did to me and for what he's still doing to me."" 'I couldn't and wouldn't contact Tony Hatch myself. It would be inappropriate because we're in litigation.' Instead, he passed the message to Trent's son from her first marriage, Darren, who Hatch had adopted when they married. Gregory said: 'Darren rang, giving it the smooth patter of, ""Oh, they had such a lovely warm life together"", which they did not. And when he said he wanted to invite Hatch to the cremation, I said quite firmly, ""No. If he turns up, I shall call the police."" 'Suffice it to say that Jackie would not want Tony Hatch anywhere near her final moments on this earth. He and his wife were specifically banned from attending her funeral, or anything in connection with it. 'Jackie always told me, ""No service – just you.""' The cremation was held on the Spanish island of Menorca, where Trent lived with Gregory. It is also home to Hatch and his wife. Hatch, 75, clearly got the message, writing on his Facebook page on the day of the funeral: 'Today was final departure day for her soul but I was BANNED by her husband Colin Gregory from attending the crematorium.' Gregory now plans to bring Trent's ashes home to Britain for a memorial service in May at her local parish church in Chesterton, Staffordshire. Much of Trent's wealth, he said, had recently been eroded – not least by the legal battle with her former husband over the songs, which Gregory claimed has cost about £20,000. It's a far cry from 1965 when Hatch and Trent met and fell in love. Hatch was already married and the couple embarked on an affair before marrying the next year and going on to become one of the most successful teams in music, earning millions of pounds. But if Hatch, the son of a pianist, who grew up in Pinner, North West London, and Trent, the daughter of a miner from Newcastle-under-Lyme, made a fortune, they seemed to have trouble holding on to it. The couple moved to Ireland at one point because of its tax benefits for artists. Hatch wrote the theme tune to Crossroads and is still remembered by many as the 'Mr Nasty' judge on 1970s TV talent show New Faces. In 1982, the pair moved to Australia and were later asked to write the theme song for Neighbours. Their marriage ended abruptly and abrasively back in Britain at Trent's 55th birthday party in 1995, when Hatch confessed that for years he had been in love with one of his wife's friends. Trent was devastated. Gregory plans to persevere with Trent's legal battle over the disputed songs: 'not for financial gain – Jackie was getting her share [of songwriting royalties] – but because it was her dying wish that he finally admitted she co-wrote those songs.' Hatch declined to comment.","Tony Hatch and Jackie Trent wrote chart-topping hits for musical superstars .
They divorced after three decades of marriage but have a daughter together .
But he did not attend her funeral when Trent died at the age of 74 last month .
Her second husband 'banned Hatch from funeral for breaking his wife's heart'"
ed8674cc15b29a87d8df8de1efee353d71122272,652,True,"Our young Earth may have collided with a body similar to the planet Mercury, says a new paper. The dramatic event could explain why our planet has a hot core that gives it its magnetic field. And it could also explain why certain rare-earth elements in Earth’s mantle do not seem to originate from the planet’s other building blocks - meteorites. Oxford scientists say a Mercury-like body struck the young Earth (artist's illustration shown). The object would have been the heat source for our planet's core. The same object could have been responsible for creating the moon. It also explains where some rare-Earth elements came from . The study, by two scientists from the University of Oxford, was published in the journal Nature. Our current theory of Earth’s formation involves basically more and more asteroids and other objects accumulating into one body. However, this model cannot explain where the heat source for Earth’s core - and ultimately its magnetic field - came from. In addition, Earth’s crust and mantle appear to have a higher ratio of the rare-earth elements samarium and neodymium than most meteorites - suggesting there was more at play in Earth’s formation than first thought. To address this discrepancy, scientists believe that Earth was hit by a body that was the size of Mars - but like Mercury in its composition - early in its life. This likely would have happened about 4.5 billion years ago. The body would have been rich in sulphur but very poor in oxygen - just like Mercury. Many researchers believe the moon formed after Earth was hit by a planet the size of Mars billions of years ago. This is called the giant impact hypothesis. The hypothesis claims the moon is debris left over following an indirect collision between our planet and an astronomical body approximately 4.5 billion years ago. The colliding body is sometimes called Theia, after the mythical Greek Titan who was the mother of Selene, the goddess of the Moon. But one mystery has persisted, revealed by rocks the Apollo astronauts brought back from the moon - why are the moon and Earth so similar in their composition? Several different theories have emerged over the years to explain the similar fingerprints of Earth and the moon. Perhaps the impact created a huge cloud of debris that mixed thoroughly with the Earth and then later condensed to form the moon. Or Theia could have, coincidentally, been isotopically similar to young Earth. A third possibility is that the moon formed from Earthen materials, rather than from Theia, although this would have been a very unusual type of impact. Our current theory of Earth’s (left) formation involves basically more and more asteroids and other objects accumulating into one body. Now scientists think that Earth was hit by a body that was the size of Mars, but like Mercury (right) in its composition, early in its life. In the young solar system 4.5 billion years ago, illustrated, various planetesimals and other small bodies coalesced together to form larger bodies like Earth . As it collided with Earth, it would have produced radioactive uranium and thorium, generating the heat needed to drive the ‘dynamo’ of molten iron in Earth’s core. And they do not rule out the possibility that this is the same Mars-sized body that formed the moon. ‘We think that that is quite conceivable,’ said study co-author Bernard Wood, reported the LA Times. ‘It's kind of exciting to think that this reduced body could actually be the thing which caused the moon.’ In an accompanying News and Views article for Nature, Dr Richard Carlson of the Carnegie Institution for Science in Washington, DC said the theory could open up new avenues for thought.. For example, if true, it would raise further questions about ‘how Earth ended up in its present oxidised state, which it has apparently retained for more than three billion years.’","Oxford scientists say a Mercury-like body struck the young Earth .
The Mars-sized object would have been the heat source for our planet .
The same object could have been responsible for creating the moon .
It also explains where some rare-Earth elements came from ."
