id,word_count,is_long,article,reference
bcd231035ba88dd66f19fbeb2724f7ee7e6329e3,834,True,"It was heralded as the world’s oldest musical instrument; a bone with two holes in it seemingly made by Neanderthals to serenade their companions. But now a study says it’s not an instrument at all - but rather, simply a bone chewed by hyenas and left in a cave. The research suggests historians have been fooled by these phoney objects - and, in fact, all such ‘instruments’ attributed to Neanderthals are simply chew toys of animals. A researcher says a 'bone flute' found in Slovenia is not an instrument - instead, he says it is simply a bone chewed by a hyena with teeth marks. The bone is shown here, believed to be the oldest musical instrument discovered in Europe, on show in Ljubljana. The bone was discovered on 18 July 1995 in Slovenia . The latest analysis was conducted by Dr Cajus Diedrich from the Paleo-Logic Independent Institute of Geosciences. In a paper published in the Royal Society of Open Science, he took a look at several ‘musical instruments’ that had been attributed to Neanderthals. Neanderthals may have created and worn the world's first jewellery 130,000 years ago, according to scientists. Researchers examining eight talons taken from a white-tailed eagle found at Krapina in Croatia say they were used to create necklace or bracelet. The claws bear multiple cut marks, notches and signs that they had been polishing by the Neanderthals that once inhabited the site where they were found. Anthropologists at the University Kansas say the talons appear to have been made into symbolic jewellery 80,000 years before modern humans arrived in Europe. The findings add to evidence that Neanderthals were not the slow-witted and primitive creatures they are often portrayed as. One in particular, the Divje Babe Flute, is often said to be the world’s oldest musical instrument. The cave bear femur, pierced with two holes, was found in 1995 at the Divje Babe Archaeological park near Cerkno in northwestern Slovenia. Dr Diedrich said analysis of the bone shows the holes are teeth marks, and the shape is just the result of the bone not breaking when it was chewed. In most caves, carnivore damage like this can be seen in about 20 per cent of animal remains and 80 per cent of bear cub remains. But while adult remains were often ‘crushed to pieces’, bear cubs often had certain patterns like this. ‘These are not instruments, nor human made, but products of the most important cave bear scavengers of Europe, hyenas,’ Dr Diedrich wrote. ‘Hyenas left bones in repeating similar tooth mark and crush damage stages, demonstrating a butchering/bone cracking strategy. ‘Hyenas produced round-oval puncture marks in cub femora only by the bone-crushing premolar teeth of both upper and lower jaw.’ One instrument in particular, the Divje Babe Flute, is often said to be the world’s oldest musical instrument. The cave bear femur, pierced with two holes, was found in 1995 at the Divje Babe Archaeological park (shown) near Cerkno in northwestern Slovenia . The latest analysis says that many bones found in caves can simply be attributed to animals around 30,000 years ago, rather than Neanderthals. Shown is an exhibit of the life of a Neanderthal family in a cave in the Neanderthal Museum in the northern town of Krapina in Croatia . The first ‘Neanderthal flutes’ were discovered in Slovenia in the 1920s and, since then, many others have been identified. Sadly for those who thought Neanderthals might have played music in this way to one another, though, it seems the earlier analysis may have been wrong. Shown is the 'Divje Babe flute' bear bone, believed to be the oldest musical instrument discovered in Europe, in the National Museum in Ljubljana . Dr Diedrich derides all the research that has gone into these bones so far. He also points out that there is no evidence on the bones that tools have been used to make the holes, further cementing the idea they were made by hyena teeth. What’s more, he also said that most of the ‘bone flutes’ do not actually date from Neanderthal times - 200,000 to 30,000 years ago. Rather, he says they can more closely be attributed to the Aurignacian culture 38,000 to 29,000 years ago - sometimes said to be the first modern humans in Europe, owing to their grasp of using tools. ‘The “cave bear cub femora with holes” are, in all cases, neither instruments nor human made at all,’ he concludes. ‘All cave bear pseudo-bone flutes are not dated to Neanderthal Middle Palaeolithic Mousterian layers, but instead, if possible to date, to Late Palaeolithic, Aurignacian/Gravettian layers.’ He added: ‘Hyenas left, therefore, “pseudo-bone flutes” during the Late Middle to Late Pleistocene all over Europe in cave bear dens, and on different cave bear species/subspecies. ‘This is known due to lack of breakage on most of the cave bear cub femora, which generally show additional diagonal zigzag margins (from chewing joints by scissor teeth of hyenas) or have triangular or smaller scratch tooth marks.’","Researcher says a 'bone flute' found in Slovenia is not an instrument .
Instead he says it is simply a bone chewed by a hyena with teeth marks .
He claims all such instruments were made by hyenas, not Neanderthals .
And the bones do not even originate from Neanderthal times ."
51330b87d3a7fc3efd854f2a569364c55ff5426a,719,True,"Gary Hooper came off the bench to snatch a dramatic stoppage-time winner to keep Norwich City on track for automatic promotion in the Sky Bet Championship after Neil Lennon's battling Bolton came within minutes of gaining a point. Former Celtic star Hooper's goal sparked jubilant scenes on the Canaries bench in contrast to the dejection of his one-time Parkhead boss Neil Lennon. Indeed, Hooper had been a transfer target for Lennon earlier in the season so his winning goal was a double blow for the Ulsterman. Gary Hooper celebrates after earning Norwich three points with a stoppage-time winner against Bolton . Former Celtic striker Hooper is mobbed by his team-mates as Norwich remained second in the Championship . Bolton: Bogdan, Vela, Dervite, Ream, Moxey, Bannan, Walker (Janko 87), Feeney, Gudjohnsen (Danns 82), Heskey, Le Fondre . Subs not used: Lonergan, M Davies, Trotter, Rochinha, McCarthy . Booked: Walker, Moxey . Scorer(s): Le Fondre . Norwich: Ruddy; Whittaker (R Bennett 71), Martin, Bassong, Olsson, Tettey, Howson, Dorrans, Hoolahan (Grabban 57), Redmond (Hooper 66), Jerome . Subs not used: Rudd, E Bennett, O'Neil, Odjidja-Ofoe . Booked: Bennett . Scorer(s): Dorrans 9, Hooper 90+ . Referee: James Adcock . Graham Dorrans gave the Canaries an early lead as his right-footed free-kick deflected off Josh Vela into the net, but Adam Le Fondre looked to have rescued a point and extended Bolton's unbeaten run to four games. Instead, Hooper lobbed keeper Adam Bogdan - as the Wanderers defenders switched off - to score an invaluable goal. Lennon had promised his side would spoil a few parties in the remaining games of the season with Brantford and Bournemouth coming up in the next few weeks. That looked to be the case until Hooper's strike made it five wins in the last six meetings between the teams. Norwich made the perfect start with Dorrans' deflected free-kick after Vela took down Nathan Redmond on the edge of the area. The Canaries should have doubled their advantage six minutes later as Sebastien Bassong rose highest at a corner but cleared Bogdan's crossbar by some distance. Hooper lobs the ball over Adam Bogdan to spark jubilant scenes on the Canaries bench . Former West Brom midfielder Graham DOrrans celebrates after giving the visitors the lead on Saturday . And the visitors were in total control when Wanderers drew level totally against the run of play. It was so one-sided manager Lennon was poised to bring on Neil Danns to shore up his midfield. Instead, youngster Tom Walker, who had been guilty of delaying a cross moments earlier, learned his lesson. His flashing centre from the left picked out Le Fondre inside the six-yard box and the on-loan Cardiff City striker, back in the side after missing the Easter Monday trip to South Wales, finished with ease. Walker continued to prove a threat to the visitors' defence with his elusive running and was harshly booked for a foul on Wes Hoolahan. Liam Feeney shot narrowly wide from another Walker cross that fizzed beyond three static Norwich defenders before the Canaries rediscovered their composure. Top scorer Cameron Jerome, whose double won the reverse fixture at Carrow Road last October, brought a smart save out of Bogdan while the Hungarian international needed treatment after punching away another dangerous-looking Dorrans free-kick. Norwich striker Cameron Jerome heads towards goal during the clash at the Macron Stadium . The second half was much more competitive and Wanderers were more of a match for their high flying visitors. So much so that Neil brought on Lewis Grabban after 57 minutes for Hoolahan. And Grabban made an immediate impact, bringing out a save from Bogdan before Tim Ream cleared off the line from first-half scorer Dorrans. However, Bolton had their moments going forward too with Le Fondre trying cheekily to chip John Ruddy while Alex Tettey cleared off the line after Dorian Dervite narrowly failed to connect with Walker's corner. Neil's intention's were clear and with 20 minutes left had made his full set of substitutions with Hooper replacing Nathan Redmond and Steven Whittaker going off for Ryan Bennett. The visitors were incensed they did not get a penalty when Russell Martin's cross hit Dean Moxey on the hand. But any ill luck was cancelled out in injury time as hot shot Hooper slotted his winner.","Norwich beat Bolton 2-1 at the Macron Stadium in the Championship .
Graham Dorrans gave the visitors the lead inside 10 minutes .
Adam Le Fondre drew Neil Lennon's side level after 18 .
Gary Hooper won the game for Norwich in the closing moments .
Norwich remain second ahead of Watford on goal difference ."
a27c3b016d3e11d2ac55632af3d9f64b20ecb052,212,False,"Barcelona are fighting for a league and cup double this season but midfield playmaker Ivan Rakitic enjoyed some time away from the heat of battle with his family to celebrate St George's day. Rakitic shared a picture with his 425,000 Instagram followers of him with his wife and daughter with the caption 'Happy St George's Day, I will enjoy with my princesses.' Rakitic's wife, Raquel Mauri, also posted an image of her celebrations with Barcelona star Rakitic. Ivan Rakitic poses alongside his wife Raquel Mauri as the pair enjoy the St George's day celebrations . Barcelona man Rakitic also shared a picture with his wife and daughter, who he described as his 'princesses' Rakitic (left) has been an integral part of Barcelona's team since signing from Sevilla . Rakitic played the full 90 minutes as Barcelona sealed progress to the semi-final of the Champions League with a 5-1 aggregate victory over Paris Saint-Germain thanks to a 2-0 win on Tuesday. The Croatia midfielder has been instrumental for Luis Enrique's La Liga-leading side since signing from rivals Sevilla in June. Barcelona have a two-point lead over Real Madrid in the Spanish league with six games remaining. They also await Friday's Champions League semi-final draw, where they could face Madrid, Juventus or Bayern Munich.","Ivan Rakitic celebrated St George's Day with his wife and daughter .
The Barcelona midfielder played the whole game in Tuesday's PSG win .
Barcelona lead La Liga by two points and are in Champions League semis .
CLICK HERE for Sportsmail's lowdown on the Champions League final four .
Who will win the Champions League? Our reporters have their say..."
7f86db7661c4a6d63e8c4eb181788faa9019fc63,288,False,"Blackburn Rovers boss Gary Bowyer has challenged star striker Jordan Rhodes to become an FA Cup hero as the Championship underdogs face Liverpool in the first full house at Ewood Park since 2011. Rovers rejected a £12million bid from Hull City for Scotland international Rhodes at the start of the season — a decision that will be vindicated should the 17-goal striker score the winner in Wednesday night's sixth-round replay and take his side to Wembley. ‘Someone has got to be the hero for Blackburn Rovers,’ said Bowyer. ‘We will need heroes in terms of defending and work-rate, but we also need a match-winner and there is probably no-one better than Jordan Rhodes. Hopefully he can step up and have his name in lights.’ Blackburn boss Gary Bowyer has said Jordan Rhodes (centre) can become an Ewood Park hero . Rhodes goes into the FA Cup replay on the back of scoring in Blackburn's 3-0 win over Leeds . Rovers were a laughing stock when they were last in the FA Cup quarter-finals in 2013 and only 8,000 turned up at Ewood Park to see them lose to Millwall, but Bowyer said: ‘There will be an extra 20,000 people in the stadium compared to that game against Millwall. 'I think it’s recognition from the supporters who have realised the amount of hard work that’s gone into what we’re trying to do, myself and the staff.’ Blackburn’s run is even more impressive because of a restricted squad of 24 players due to breaching Financial Fair Play rules. They also have injuries to Josh King, Chris Taylor, Rudy Gestede and Grant Hanley. Rovers boss Bowyer believes his side will be buoyed by the 'extra 20,000 people' at Ewood Park .","Gary Bowyer hopes Jordan Rhodes can fire Blackburn into next round .
Blackburn face Liverpool at home after drawing with the Reds at Anfield .
The Championship outfit will have their first sell-out crowd since 2011 ."
f8e569d2d6ba2128734f2aecfba17e3121149df3,694,True,"A Hollywood-inspired experiment to help dementia patients by waking them up with video recordings from loved ones is taking place in New York. The hope is that the videos shown to residents of a care home in the city will ease their confusion, forgetfulness and agitation. The idea is borrowed from the 2004 Adam Sandler film 50 First Dates, in which Drew Barrymore's character suffers a brain injury and memory loss each day. A suitor, played by Sandler, uses videos to remind her of him. Charlotte Dell, director of social services at Hebrew Home in Riverdale, said the film was 'fluff', but added it inspired her to think about how the idea could help residents. The film 50 First Dates starring Adam Sandler and Drew Barrymore has inspired a new dementia experiment taking place at a care home in Riverdale, New York . 'We're looking to see if we can set a positive tone for the day,' without using drugs, she said. 'What better way to start the day than to see the face and hear the voice of someone you love wishing you a wonderful morning?' As in the film, each day a new video is shown to residents. Relatives are encouraged to take part to say good morning, use memory-triggering personal anecdotes and remind their loved ones that care home staff will be helping them get dressed and ready for the day. People suffering Alzheimer's disease and other forms of dementia often fell confused and anxious in the morning. The programme is designed to help those who are in the early to moderate stages of dementia, those who are still likely to recognise the people in the video and understand what they are saying. Ms Dell said: 'Do we know for sure that they know, this is my daughter, this is my son? No. 'But they recognise them as somebody they care about and love.' The Hebrew Home is planning to evaluate the programme next month, with the aim of expanding it to several hundred residents in its memory-care 'neighbourhoods'. Ms Dell said anecdotal evidence so far from staff at the home is 'very positive'. Robert Abrams, a geriatric psychiatrist at New York Presbyterian Hospital said the pilot is 'both innovative and thoughtful'. 'You've got a group of people with dementia who don't really grasp the nature and purpose of their surroundings or the circumstances that compelled them to be there,' he said. 'Consequently they're alone and at sea and feel frightened and even abandoned by family.' Resident Louisa Irving, 94, is one of several dementia sufferers at Hebrew Care Home, who is woken up each morning with a video recording from a loved one to help ease confusion and agitation . Her daughter Tamara Rusoff-Hoen, pictured in the striped top, records messages including stories of happy memories and family get-togethers, signing off with the family goodbye, 'Kiss, kiss, I love you' Among the residents taking part in the study is 94-year-old dementia sufferer, Louisa Irving. She wakes up each day to a video from her daughter Tamara Rusoff-Hoen, who sings: 'Good morning, merry sunshine, how did you wake so soon?' to her mother. The five-minute video includes stories of happy memories and get-togethers, and often inspires a bright smile from Ms Irving, before her daughter signs off with the family goodbye: 'Kiss, kiss, I love you.' Ms Rusoff-Hoen, said: 'Some of her agitation comes from, ""Who the heck are these people? Why am I here?"".' Although Ms Rusoff-Hoen, who lives a few hours away in Ghent, visits her mother three days a week, she said the video allows her to fill in the gaps. 'I am there with my mum, loving her and wishing her a wonderful day and helping her to feel better because there's not a lot I can do for her.' Other videos include a woman reminding her mother, in Spainish, to eat and take her medications before telling her: 'I love you, mum.' And in another, a man encourages his mother, telling her: 'You used to tell me that attitude is everything. You said that it's best to start off on the sunny side of the street.'","Residents at Hebrew Care Home in New York are woken by video recordings from loved ones to help ease their confusion and agitation .
Idea was inspired by the 2004 film 50 First Dates starring Adam Sandler .
Experiment will be evaluated next month but results are 'very positive'"
f998651596b3a0709d7ceb39f4f72ae59eea65e5,408,True,"West Ham manager Sam Allardyce believes filling your home ground is paramount to Premier League clubs - with the Hammers announcing their new season-ticket structure ahead of the move to the Olympic Stadium. Karren Brady, vice-chairman of West Ham, announced during the week that the club would be making significant cuts to their current pricing as the move is being offset against increased television revenue. The cheapest season ticket at Upton Park is £620 but there will be £289 seats on offer from the 2016-17 season - the club's first in the 54,000-seater Olympic Stadium. West Ham's season tickets will cost as little as £289 when the club move to the Olympic Stadium next year . Manager Sam Allardyce says filling the stadium is the most important thing for any football club . West Ham's vice-chairman Karren Brady visited the club's future home in Stratford on Tuesday . And Allardyce believes performing in front of a sold-out crowd is something that should not go unappreciated as the other 19 Premier League clubs are now being pushed to follow West Ham's lead. 'The most important thing at a football club is to fill the stadium,' he said. 'I think filling the stadium is the ultimate for the success of the team. Obviously it's not from a revenue base like it used to be. 'The revenue base for a football club used to be the sustainability of the football club in my years before the Premier League and before Sky made it a worldwide brand. A view of the Olympic Stadium on Tuesday ahead of West Ham's switch to the 54,000-capacity arena . 'It's about creating the atmosphere in a stadium that thrills not only the fans there enjoying the atmosphere, but the players who respond to that . 'To make sure everywhere you go in the Premier League maintains a high level of attendance and selling out your stadium has to be the ultimate goal for any Premier League football club, for me. An artist's impression of what the Olympic Stadium will look like during a West Ham match . 'What we've announced has to be the best piece of business, for me, seen in the Premier League for a long, long time. 'Hopefully everybody at West Ham football club, particularly the fan, will come and enjoy, as Karren says, a fantastic facility for less. That will only encourage future young West Ham supporters to be West Ham supporters.'","West Ham move to the Olympic Stadium ahead of the 2016-17 season .
Karen Brady announced reduced season ticket prices ahead of move .
Cheapest price will be £289, down from the current cheapest of £620 .
Sam Allardyce says filing the stadium is most important thing for a club ."
