id,word_count,is_long,article,reference
7412df1f45d5df7b47f6b462945ef1d6e99eb16a,1465,True,"Have you ever wondered exactly what happens to the unused toiletries in hotel room bathrooms? Or how a hotel handles it if a guest dies during their stay? Hotel industry insider turned author Jacob Tomsky shares his tales from working in two top hotels in New Orleans and New York City and provides lots of little-known tips to ensure guests make the most of every hotel stay. MailOnline Travel chatted with Tomsky to get the answers to some of our most burning hotel questions... Scroll down for video . Hotel industry insider turned author, Jacob Tomsky, reveals the most common items people take from hotels . What are some of the most common items that people take from hotels? Without a doubt, toiletries and towels are definitely the most popular items for guests to pocket, according to Jacob Tomsky, author of Heads in Beds: A Reckless Memoir of Hotels, Hustles, and So-Called Hospitality. But some individuals staying at the hotel take things a bit too far. 'They take everything,' he tells MailOnline Travel. 'Duvet covers, little silver trashcans, universal remotes - anything that's not nailed down.' Despite common misconceptions, it is possible to pocket a plush robe - without incurring any charges . What can you usually get away with taking? Despite common misconceptions, you actually can get away with stealing that coveted hotel room robe. 'If you were to, say, check into a room, take a fresh robe and pack it away in your suitcase, then call down and say your room didn't have a robe in it when you checked in, is the hotel staff going to search your belongings? Highly unlikely,' Tomsky reveals. And when it comes to pocketing toiletries, you can occasionally even ask for more. 'There are other items, as well - complimentary amenities that you may not be aware are available,' he explains. 'Good hotels keep extra items, such as slippers, razors and shaving cream, travel lint rollers, and mini-deodorants, in stock but not displayed in the room.' As it turns out, the minibar is the most fallible system in the hotel, full of items 'sold at an absurd mark-up' If you lie about using the minibar, will the hotel really charge you? 'The minibar is the most fallible system in the hotel,' Tomsky tells MailOnline Travel. 'Human error, over-stocking, failure to re-stock, errant charges from weighted items being shifted but not consumed, all of these lead the front desk to spend hours a day slicing off incorrect charges.' He also notes that the 'items are purchased in bulk and sold at an absurd mark-up.' 'Hotels are much more concerned with your overall experience and securing further room nights - the main revenue stream - than whether or not you ate a candy bar.' Mike Holovacs, a front office supervisor at a major hotel chain and an adjunct hospitality instructor, adds: 'If an item has not sold, it's just like any other retail setting - the item is pulled when it reaches its expiration date.' Because certain rooms have varying levels of cleaning difficulty, they are usually awarded 'points' How long does it take to clean a hotel room? Is there anything that typically does not get cleaned? The length of cleaning time generally depends on the room. Because rooms have varying levels of difficulty, they are usually awarded 'points' and housekeepers must clean a certain total of points in one day. This may translate to a few larger suites or simply multiple standard rooms. 'I'd guess the average time is between 30 minutes to an hour to flip the room,' Tomsky estimates. 'A great deal of that time discrepancy depends on how the guest has left the room.' Once a year, large sections of rooms, or even entire floors are pulled out of service for maintenance and deep cleaning. 'This is includes sending the draperies out for cleaning and shampooing the carpets,' Holovacs explains. However, minibar glasses are often cleaned less thoroughly, usually soaked in shampoo or furniture polish . When it comes to the items that are cleaned less frequently or less thoroughly? Minibar glasses and the remote control. 'Housekeepers are usually responsible for cleaning the glasses, yet are not provided with dish soap,' he explains. 'So they either soak them in the sink with shampoo or, in a pinch, use furniture polish, as it leaves a 'clean-looking' shine.' And have you ever tried to clean your own remote? 'The rubbery buttons make it near impossible and dousing it with a cleaning agent could damage the circuitry,' Tomsky adds. How much money hotels spend on toiletries generally depends on the scale of the property and its occupancy . How much do hotels generally spend on toiletries per year? This one has everything to do with the scale of the property and its occupancy. According to a recent Forbes article, the Marriott hotel chain will spend approximately $20 million annually on their Thann products, a natural skincare line that's stocked in their Americas and Asia Pacific hotels. 'Usually the ordering is done by a housekeeping manager who takes into account the current supply and the average monthly uses from years past,' Tomsky reveals. 'People use more toiletries in the winter, have longer showers, and go through more toilet paper. 'It's a rather intriguing ordering process based on a large amount of collected data. 'And, ultimately, you don't want to be the one who fails to order enough toilet paper for the entire hotel.' Though there's a belief that hotel staffer furnish their home with amenities, Tomsky says it's not often the case . And do staff ever get to take them home? 'There's a long history of hotel staffers semi-furnishing their own home with hotel amenities,' Tomsky admits. 'Every party I threw from 2001 to 2004 was catered with hotel pillow chocolates. 'For the most part, items are either so pre-used that to take them would be distasteful, or so expensive that to steal them wouldn't be worth the loss of one's job. 'But I do have shoe polish that I've never paid for and hotel-branded slippers to keep me comfy in the wintertime.' One charity has come up with a novel way to deal with leftover hotel soaps - churning them together to provide soap to those in developing countries. Clean The World, receives partially-used and discarded soap from hotels, recycles it into millions of new bars, and then works with partner Global Soap to strategically distribute the new soap to people who lack access to it around the world. People dying in their hotel room is not quite as rare of an occurrence as guests may think, Tomsky admits . What happens if someone dies in a hotel room? While a bit morbid to talk about, Tomsky admits that such an occurrence is not quite as rare as guests may think. 'It's not something a hotel wishes to publicise, naturally,' he explains. 'So, they are removed as discreetly as possible. 'This may involve flashing lights and paramedics, depending on the severity of the situation, but can also happen via employee elevators and back exits.' Afterwards, the room is sanitised, cleaned, 'flipped' and sold - and that can happen a lot faster than you'd think. And, of course, all hotel staffers are forbidden from revealing any details - including cause of death and room numbers - to anyone. 'Death is a part of hotel life,' Tomsky adds. 'In fact, suicides often prefer hotels, relieving loved ones of the cleaning duties or seeing the deceased in a disturbing way.' Guests should take comfort in knowing that their in-room safes are actually very secure . Do staff actually have access to the in-room safes? No, they do not. The safes truly are, you know, safe. 'I always recommend using the safe to every traveller,' Tomsky says. 'The only person who can open the safe, should you forget your password, is a manager from the security department, using a tool that only they are trained and authorised to use.' What really happens to that half-used roll of loo paper in hotel room bathrooms? Well, it depends... And finally, what happens to the half-used loo roll in hotel room bathrooms? There's a bit of dispute over this one, and again, a lot of times it depends on the hotel itself. In the spirit of being environmentally-minded, most chains will simply refold the paper and leave the half-used roll in the bathroom, with another full roll behind it, should the guest run out. If there's not enough left to warrant leaving it, a Quora thread user, who works for the Beechmont Hotels Corporation, believes that the nearly-used up roll most likely winds up on housekeeping carts for when a room attendant needs a tissue for other cleaning tasks or in employee bathrooms.","Yes, it is possible to steal a robe from your hotel without being charged .
Many properties often have extra complimentary amenities up for grabs .
But beware of minibar glasses - they're often cleaned with furniture polish .
Author Jacob Tomsky answers every question you have about hotel stays ."
e1be4947973575bcaf151c5bf4657b8d34688ff7,763,True,"The highest-ranking military officer in the United States has apologized to a bereaved military mom after saying the Iraqi city where he died is 'not symbolic in any way'. General Martin Dempsey, Chairman of the Joint Chiefs of Staff, sent a letter saying he regretted that he 'added to the grief' of Debbie Lee, whose son Marc was killed in Ramadi on August 2, 2006. The 28-year-old, the first Navy SEAL to die in Iraq, was fatally wounded while providing covering fire from a building in the heavily-contested city. He was awarded the Purple Heart and Silver Star for his bravery. Humbled: General Martin Dempsey, Chairman of the Joint Chiefs of Staff, apologized to a military mother for belittling the sacrifice of her slain son . Fallen hero: Marc Lee, right, was killed in Ramadi in August 2006. His mother Debbie, left, was outraged when Dempsey wrote off the city as 'not symbolic in any way' while discussing operations against ISIS . Dempsey had spoken dismissively of the city last week at a briefing when asked how damaging to U.S. and Iraq's military efforts it would be were the city to fall into the hands of ISIS. Responding to a journalist's question, he said: 'The city itself is not symbolic in any way. It hasn’t been declared the caliphate or central to Iraq. 'The issue isn’t brick and mortar. It is about defeating ISIS. I would much rather that Ramadi not fall, but it will not be the end of a campaign.' The remarks outraged Lee, who said she was shaking and reduced to tears to hear the general trivialize the city for which her son had died. In response Lee, from Surprise, Arizona, posted an angry open letter on the website for America's Mighty Warriors, a charity she set up to help servicemen and honor her son. She said: 'I am shaking and tears are flowing down my cheeks as I watch the news and listen to the insensitive, pain-inflicting comments made by you in regards to the fall of Ramadi.' Ramadi was a center of Al-Qaeda operations in 2006, when Petty officer Lee and his comrades were sent in to recapture the city, an effort which ultimately took months and saw some 80 U.S. casualties. Valor: Lee, who was the first Navy SEAL to die in Iraq, was posthumously awarded the Silver Star and Purple Heart . Lee continued: 'My son Marc Lee was the first Navy SEAL who sacrificed his life in Ramadi Iraq Aug 2, 2006. His blood is still in that soil and forever will be. Remember that was when so many of our loved ones were taken from us.' Rounding on Dempsey later in the letter, she wrote: 'You, sir, owe an apology to the families whose loved ones blood was shed in Ramadi. Ramadi matters to us and is very symbolic to us. 'You need to apologize to our troops whose bodies were blown to pieces from IEDs and bullet holes leaving parts and pieces behind, Ramadi matters to them.... You and this administration have minimized that Ramadi could fall, now you are minimizing that it is falling, but you, sir, WILL NOT minimize the sacrifice my son Marc Lee made or any of our brave warriors!' Battle: Lee fell while providing covering fire for his allies in Ramadi. Pictured about are three Iraqi soldiers and a Marine fighting in the city in 2006 . Lee's message was shared widely enough that Dempsey read it, prompting him to send an apology. Dempsey's reply, published Tuesday by Fox News, attempted to justify his remarks by saying he was explaining how the U.S. is engaged with a 'different enemy'. He wrote: 'I've read your letter, and I do apologize if I've added to your grief. 'Marc and so many others died fighting to provide a better future for Iraq. He and those with whom he served did all that their nation asked. 'They won their fight, and nothing will ever diminish their accomplishments nor the honor in which we hold their service. 'We are in a different fight now, with a different enemy, and with a different relationship with the Government of Iraq. 'They must determine the path and pace of this fight. That's what I intended to convey.' Discussing the apology with Fox, Lee termed it 'soft', but said that she does accept it. She was also expecting a phone call from him at some point today. Response: Debbie Lee was sent the above letter from Dempsey after he found her angry open letter to him .","General Martin Dempsey sent apology to Debbie Lee, whose son died in Iraq .
Petty Officer Marc Lee, 28, was killed in 2006 in battle over Ramadi .
Dempsey had belittled importance of Ramadi at a news conference last week .
Lee said hearing Dempsey trivialize son's sacrifice brought her to tears .
Castigated general in open letter online, to which he has now responded ."
714163fe2ef9ac5228ad8e6f56d52c2911c2f686,898,True,"Kevin Gameiro saved his goalkeeper's blushes with a late equaliser which put defending champions Sevilla into the last four of the Europa League. Beto had looked to have cost his side their progress, with the game heading towards extra time, before substitute Gameiro arrived to slot home with five minutes remaining. It had been a risk to start the Portuguese keeper, but Sevilla boss Unai Emery decided it one he was prepared to take, despite Beto's absence since a game against Real Madrid in the first week of February. Carlos Bacca slams home the early penalty after Vitolo had been brought down by Neto after five minute . Hulk celebrates his goal with Axel Witsel but Zenit couldn't hold on for extra time in the end . It was a gamble that spectacularly back-fired, with the keeper gifting Zenit two of the softest goals imaginable, to see the holders surrender a two-goal lead in the tie. First, just a matter of seconds after the half-time break, with Sevilla two goals up on aggregate a cruising, Beto dropped the ball, under no pressure, at the feet of Salomon Rondon, allowing the Venezuelan to rekindle the tie from a matter of yards. Then, when Brazilian forward Hulk hit a speculative, but not overly threatening shot from 40 yards, Beto could only flap it over his own line, turning the tie on its head and sending it towards extra time. But as Zenit looked to apply the pressure, and Beto attempted to atone himself with two stunning saves, one from each of the two goalscorers, the champions struck on the break. Bacca is mobbed by his Sevilla team-mates after putting them in complete control of the tie early on . Zenit: Lodygin, Criscito, Neto, Lombaerts, Smolnikov; Garcia, Witsel; Danny, Shatov, Hulk, Rondon (Kerzhakov 83 mins) Subs not used: Malafeev, Rodic, Anyukov, Tymoshchuk, Sheydaev, Arshavin . Goal: Rondon 48, Hulk 72 . Booked: Neto, Witsel, Lodygin . Sevilla: Beto, Tremoulinas, Pareja (Iborra 22), Coke, Carrico, Vidal, Vitolo (Suarez 92), Banega, Mbia, Krychowiak, Bacca (Gameiro 72) Subs not used: Rico, Figueiras, Navarro, Reyes . Goal: Bacca 6, Gameiro 85 . Booked: Iborra . It was a pulsating finish to a game that had started promisingly, but looked to have faded away somewhat in the first half. The Spanish side carried a slim lead, given them by a stunning Denis Suarez volley at the end of the first leg, into the second game, but Zenit were optimistic after scoring an away goal in Seville, which gave them a perceived edge. That advantage lasted little more than five minutes however, as defender Neto stupidly dived in on Sevilla winger Vitolo, to concede an early penalty. It was a bizarre challenge to make, with Vitolo running towards the byline, and the ball not even close to within winning distance. The contact may have been minimal, but the fact that it was there at all was as much down to Neto's stupidity as anything else, and it was hard to feel sympathy for the Portuguese defender. Carlos Bacca was not in the mood to show any mercy, dispatching the spot-kick beautifully, high into the top corner, and the visitors were in complete control. From then the pattern of play was set, with Sevilla inviting pressure, absorbing it, and hitting Zenit on the break. Indeed, the visitors, two goals ahead on aggregate and with the majority of the game in their own half, had much the better chances in the first period. Coke tries to get a shot away as Sevilla threatened on the break, before Zenit hit back in the second half . Zenit midfielder Axel Witsel challenges Sevilla's Benoit Tremoulinas during a tense first half . Aleix Vidal should have put them further in front, after out-pacing former Manchester City midfielder Javi Garcia, but he seemed to forget that running is not enough, failing to either pass or shoot and simply running into Yuri Lodygin. Soon after Bacca sprang the offside trap and rounded the Zenit keeper, only to see his shot cleared off the line by Igor Smolnikov. Andre Villas-Boas' team barely registered a shot before first-half stoppage time, the one exception coming in the 18th minute, when captain Danny exchanged passes with Hulk before seeing his near-post shot saved by Beto. But, as the first 45 approached its conclusion, the hosts suddenly produced a succession of chances, and could easily have got themselves back into the tie. Salomon Rondon, whose goal got Zenit back in the tie, was starved of service for long periods of the game . First Salomon Rondon, almost entirely ineffectual up front in the opening period, was gifted the ball three yards from goal following some dubious defending at a set piece, but the Venezuelan striker couldn't sort his feet out, and stumbled the ball away from target. Moments later Danny struck the base of the post with a vicious effort that suggested Zenit might have more to offer in the final quarter of the tie. Not that they could have expected the sort of favours that Beto handed them in the second period, and which looked to have at least earned them an extra 30 minutes. In the end though, it was the home side's defending that let them down, failing to keep the back door shut as they pushed for a winner, allowing Gameiro to do the damage.","Carlos Bacca puts Sevilla ahead from the spot after Vitolo was fouled .
Salomon Rondon equalises following blunder from Beto .
Beto gives away second goal when he turns Hulk shot over his own line .
Kevin Gameiro wins the tie for Sevilla on break in closing minutes ."
4c02a3ff93a32d002f894e272936b673b51b03d4,737,True,"A recent meeting between a freshman Republican congressman from California and his constituents took an unexpected turn when Rep Steve Knight was caught on camera threatening an anti-immigration protester with violence. Knight, 48, a former Los Angeles police officer who was elected to represent the 25th Congressional District last year, was hosting an open house event at his Simi Valley office last Friday when he was accosted by a group of activists rallying against amnesty for undocumented immigrants. The heated exchange between Knight and the group of protesters carrying anti-immigration signs was captured on video and later uploaded onto YouTube by a right-wing group called We The People Rising. Ambush: Rep Steve Knight (left) was accosted by activists rallying against amnesty for illegal immigrants outside his Simi Valley, California, office during an open house last Friday . Crossing a line: A man named 'Mike' (right) accused Knight of lying about his voting record and patted him on the back after a prolonged handshake . Tempers flare: Knight, a former LAPD officer, went after Mike, telling him, 'If you touch me again, I'll drop your a**' Defense: Knight went on to explain to the activists that he never voted in support of ‘amnesty’ for immigrants . In the 2-minute clip, Knight is approached by a man who introduces himself as 'Mike' and proceeds to shake the lawmaker's hand at lenght. During the awkward encounter, Mike informs Knight: 'You told me you didn't vote for amnesty and you did. I looked it up on the Internet. You lied to me.' Voting record: Knight was one of 75 House Republicans who voted to pass a bill funding the Department of Homeland Security after it had been stripped off provisions blocking Obama's immigration reform . The protester then gives Knight a pat on the back and tries to walk away, but the lawmaker calls after him, grasps his upper arm and says: 'If you touch me again, I'll drop your a**.' Following the foul-mouthed remark, the former cop-turned-lawmaker goes on to explain to the activists that he never voted in support of ‘amnesty’ for immigrants, saying there were several versions of the same bill, known as HB 240, and he voted for the one that did not have the provisions supporting President Obama’s immigration reform. The bill that sparked the verbal spat outside Knight’s office was the subject of a protracted legislative tug-of-war between Democrats and Republicans in Congress two months ago. Right-wing lawmakers originally had inserted amendments into a bill providing nearly $40million in funding for the Department of Homeland Security to block President Obama's immigration reforms. After Senate Democrats successfully blocked the bill, 75 House Republicans, including Knight, gave in to prevent a shutdown and passed a ‘clean’ bill stripped off all provisions seeking to obstruct Obama’s executive orders on immigration, and thus lifting the threat of deportation against millions of undocumented immigrants. In the videotaped conversation with the protesters Friday, Knight insisted he never voted to support Obama's immigration reform. Knight, a US Army veteran, was elected to the US House of Representatives last November . House Speaker John Boehner of Ohio administers a ceremonial re-enactment of the House oath-of-office to Rep.  Steve Knight R-Calif., accompanied by his his wife Lily Knight and family, January 6, 2015, on Capitol Hill . ‘I never voted for amnesty. Never, ever,’ he said. Knight, a US Army veteran and married father of two, spent 18 years on the LAPD force before being elected to the California State Assembly in 2008. Two years later, he became a state senator and in 2014 was elected to the US House of Representatives. Following the release of the video, Knight put out a statement Tuesday apologizing for his conduct. ‘I have dealt with this group on several occasions and every time they try to escalate our conversations to a level that is not constructive,’ Knight said. ‘Over this past weekend, I lost my cool and I regret responding the way I did.’ The group that staged Friday’s protest, Save Our State, has been accused of having ties to white supremacists, reported Politico. In 2010, Save Our State organized a demonstration in California during which a local city councilman sparked an outrage by referring to himself as a ‘proud racist.’ Mea culpa: Following the release of the video, Knight (pictured with his wife and two sons) put out a statement Tuesday apologizing for his conduct .","Rep Steve Knight representing 25th Congressional District in California was confronted by activists from right-wing group Friday .
Protesters accused Knight of voting for immigrant 'amnesty' during congressional battle over Homeland Security funding bill .
Knight was one of 75 House Republicans who eventually voted on 'clean' funding bill devoid of provisions blocking Obama's immigration reform .
Save Our State group that accosted Knight has been linked to white supremacists ."
